{
  "$schema": "schema/tower.schema.json",
  "$comment": "Башня испытаний (K4). Этажи строятся по правилу, см. docs/content/tower.md. Все числа — заглушки до баланса.",
  "unlockAfterStage": "ch1_s5",
  "maxFloor": 100,
  "bossEvery": 5,
  "baseMult": 1,
  "statGrowthPerFloor": 0.03,
  "rewards": {
    "gold": {
      "base": 100,
      "perFloor": 15
    },
    "jobExp": {
      "base": 180,
      "perFloor": 24
    },
    "bossMultiplier": 2,
    "bossGems": 20
  },
  "bands": [
    {
      "fromFloor": 1,
      "name": "Лесной ярус",
      "layouts": [
        [
          {
            "unit": "mob_tank",
            "mult": 1.63
          },
          {
            "unit": "mob_fast",
            "mult": 1.63
          },
          {
            "unit": "mob_drops",
            "mult": 1.63
          },
          null,
          {
            "unit": "mob_mandragora",
            "mult": 1.63
          }
        ],
        [
          {
            "unit": "mob_tank",
            "mult": 1.66
          },
          {
            "unit": "mob_poporing",
            "mult": 1.66
          },
          {
            "unit": "mob_mandragora",
            "mult": 1.66
          },
          null,
          {
            "unit": "mob_lunatic",
            "mult": 1.66
          }
        ],
        [
          {
            "unit": "mob_rocker",
            "mult": 1.85
          },
          {
            "unit": "mob_poporing",
            "mult": 1.85
          },
          {
            "unit": "mob_drops",
            "mult": 1.85
          },
          {
            "unit": "mob_mandragora",
            "mult": 1.85
          },
          null
        ],
        [
          {
            "unit": "mob_tank",
            "mult": 1.63
          },
          {
            "unit": "mob_rocker",
            "mult": 1.63
          },
          {
            "unit": "mob_lunatic",
            "mult": 1.63
          },
          {
            "unit": "mob_mandragora",
            "mult": 1.63
          },
          null
        ]
      ],
      "bossLayouts": [
        [
          {
            "unit": "mob_fast",
            "mult": 1.29
          },
          {
            "unit": "mob_eclipse",
            "mult": 1.29
          },
          {
            "unit": "mob_lunatic",
            "mult": 1.29
          },
          null,
          {
            "unit": "mob_lunatic",
            "mult": 1.29
          }
        ],
        [
          {
            "unit": "mob_fast",
            "mult": 1.39
          },
          {
            "unit": "mob_mastering",
            "mult": 1.39
          },
          {
            "unit": "mob_drops",
            "mult": 1.39
          },
          {
            "unit": "mob_poporing",
            "mult": 1.39
          },
          null
        ],
        [
          {
            "unit": "mob_rocker",
            "mult": 1.35
          },
          {
            "unit": "mob_vocal",
            "mult": 1.35
          },
          {
            "unit": "mob_mandragora",
            "mult": 1.35
          },
          null,
          {
            "unit": "mob_rocker",
            "mult": 1.35
          }
        ]
      ]
    },
    {
      "fromFloor": 20,
      "name": "Болотный ярус",
      "layouts": [
        [
          {
            "unit": "mob2_tank",
            "mult": 1.61
          },
          {
            "unit": "mob2_melee",
            "mult": 1.61
          },
          {
            "unit": "mob2_ranged",
            "mult": 1.61
          },
          null,
          {
            "unit": "mob2_ranged",
            "mult": 1.61
          }
        ],
        [
          {
            "unit": "mob2_tank",
            "mult": 1.37
          },
          {
            "unit": "mob2_fast",
            "mult": 1.37
          },
          {
            "unit": "mob_poporing",
            "mult": 1.37
          },
          {
            "unit": "mob2_fast",
            "mult": 1.37
          },
          {
            "unit": "mob2_ranged",
            "mult": 1.37
          }
        ],
        [
          {
            "unit": "mob2_elite",
            "mult": 1.48
          },
          {
            "unit": "mob2_melee",
            "mult": 1.48
          },
          {
            "unit": "mob2_ranged",
            "mult": 1.48
          },
          null,
          {
            "unit": "mob2_ranged",
            "mult": 1.48
          }
        ],
        [
          {
            "unit": "mob2_elite",
            "mult": 1.25
          },
          {
            "unit": "mob2_tank",
            "mult": 1.25
          },
          {
            "unit": "mob2_ranged",
            "mult": 1.25
          },
          null,
          {
            "unit": "mob2_fast",
            "mult": 1.25
          }
        ]
      ],
      "bossLayouts": [
        [
          {
            "unit": "mob2_tank",
            "mult": 1.09
          },
          {
            "unit": "mob2_giant",
            "mult": 1.09
          },
          {
            "unit": "mob2_ranged",
            "mult": 1.09
          },
          null,
          {
            "unit": "mob2_ranged",
            "mult": 1.09
          }
        ],
        [
          {
            "unit": "mob2_elite",
            "mult": 1.01
          },
          {
            "unit": "mob2_giant",
            "mult": 1.01
          },
          {
            "unit": "mob2_ranged",
            "mult": 1.01
          },
          {
            "unit": "mob2_fast",
            "mult": 1.01
          },
          null
        ],
        [
          {
            "unit": "mob2_tank",
            "mult": 1.08
          },
          {
            "unit": "mob2_boss",
            "mult": 1.08
          },
          {
            "unit": "mob2_ranged",
            "mult": 1.08
          },
          null,
          {
            "unit": "mob2_ranged",
            "mult": 1.08
          }
        ],
        [
          {
            "unit": "mob2_elite",
            "mult": 0.84
          },
          {
            "unit": "mob2_boss",
            "mult": 0.84
          },
          {
            "unit": "mob2_ranged",
            "mult": 0.84
          },
          {
            "unit": "mob2_fast",
            "mult": 0.84
          },
          {
            "unit": "mob2_ranged",
            "mult": 0.84
          }
        ]
      ]
    },
    {
      "fromFloor": 40,
      "name": "Костяной ярус",
      "layouts": [
        [
          {
            "unit": "mob3_tank",
            "mult": 1.25
          },
          {
            "unit": "mob3_melee",
            "mult": 1.25
          },
          {
            "unit": "mob3_ranged",
            "mult": 1.25
          },
          null,
          {
            "unit": "mob3_ranged",
            "mult": 1.25
          }
        ],
        [
          {
            "unit": "mob3_tank",
            "mult": 1.14
          },
          {
            "unit": "mob3_fast",
            "mult": 1.14
          },
          {
            "unit": "mob3_ranged",
            "mult": 1.14
          },
          {
            "unit": "mob3_fast",
            "mult": 1.14
          },
          null
        ],
        [
          {
            "unit": "mob3_elite",
            "mult": 1.34
          },
          {
            "unit": "mob3_melee",
            "mult": 1.34
          },
          {
            "unit": "mob3_ranged",
            "mult": 1.34
          },
          null,
          {
            "unit": "mob3_ranged",
            "mult": 1.34
          }
        ],
        [
          {
            "unit": "mob3_elite",
            "mult": 1.01
          },
          {
            "unit": "mob3_tank",
            "mult": 1.01
          },
          {
            "unit": "mob3_ranged",
            "mult": 1.01
          },
          null,
          {
            "unit": "mob3_fast",
            "mult": 1.01
          }
        ]
      ],
      "bossLayouts": [
        [
          {
            "unit": "mob3_tank",
            "mult": 0.97
          },
          {
            "unit": "mob_osiris",
            "mult": 0.97
          },
          {
            "unit": "mob3_ranged",
            "mult": 0.97
          },
          null,
          {
            "unit": "mob3_ranged",
            "mult": 0.97
          }
        ],
        [
          {
            "unit": "mob3_elite",
            "mult": 0.76
          },
          {
            "unit": "mob_boss2",
            "mult": 0.76
          },
          {
            "unit": "mob3_ranged",
            "mult": 0.76
          },
          {
            "unit": "mob3_fast",
            "mult": 0.76
          },
          null
        ],
        [
          {
            "unit": "mob3_tank",
            "mult": 0.91
          },
          {
            "unit": "mob3_elite",
            "mult": 0.91
          },
          {
            "unit": "mob_dark_lord",
            "mult": 0.91
          },
          null,
          {
            "unit": "mob3_ranged",
            "mult": 0.91
          }
        ],
        [
          {
            "unit": "mob_osiris",
            "mult": 0.63
          },
          {
            "unit": "mob3_elite",
            "mult": 0.63
          },
          {
            "unit": "mob_boss2",
            "mult": 0.63
          },
          null,
          {
            "unit": "mob3_ranged",
            "mult": 0.63
          }
        ]
      ]
    },
    {
      "fromFloor": 60,
      "name": "Ярус владык",
      "layouts": [
        [
          {
            "unit": "mob3_tank",
            "mult": 1.25
          },
          {
            "unit": "mob3_melee",
            "mult": 1.25
          },
          {
            "unit": "mob3_ranged",
            "mult": 1.25
          },
          null,
          {
            "unit": "mob3_ranged",
            "mult": 1.25